<?xml version="1.0" encoding="euc-kr" standalone="no"?>
<!DOCTYPE superEntry SYSTEM "2007eomi.dtd">
<superEntry>
	<orth>ㄹ런지</orth>
	<entry n="1" pos="e">
		<mnt_grp>

			<cre>
				<cre_date>2001/09/01</cre_date>
				<cre_writer>이승희</cre_writer>
				<cre_note></cre_note>
			</cre>
			<mod>
				<mod_date>2001/09/17</mod_date>
				<mod_writer>이지영</mod_writer>
				<mod_note></mod_note>
			</mod>
			<mod>
				<mod_date>2006/10/01</mod_date>
				<mod_writer>박진희</mod_writer>
				<mod_note></mod_note>
			</mod>
			<mod>
				<mod_date>2007/07/07></mod_date>
				<mod_writer>하신영</mod_writer>
				<mod_note></mod_note>
			</mod>
		</mnt_grp>
		<head_grp>
			<je_subtype>efcs</je_subtype>
		</head_grp>
		<morph_grp>
			<phn_rst>vo</phn_rst>
			<mor_rst>nil</mor_rst>
			<str>nil</str>
			<var type="xs">ㄹ는지</var>
		</morph_grp>
		<sem_grp>
			<sense n="1">
				<sem_rep>
					<st></st>
					<sl></sl>
					<gm></gm>
				</sem_rep>
				<frn></frn>
				<fol></fol>
				<frame></frame>
				<sel_rst></sel_rst>
				<own_s>
					<nc></nc>
					<sp></sp>
				</own_s>
				<fol_s>
					<stt></stt>
					<prd></prd>
					<rep></rep>
					<sms></sms>
				</fol_s>
				<eg>비가 올런지 습한 바람이 불기 시작했다.</eg>
			</sense>
		</sem_grp>
		<idm_grp>
			
				<idm></idm>
				<idm_eg></idm_eg>
			
		</idm_grp>
	</entry>
	<entry n="2" pos="e">
		<mnt_grp>

			<cre>
				<cre_date>2001/09/01</cre_date>
				<cre_writer>이승희</cre_writer>
				<cre_note></cre_note>
			</cre>
			<mod>
				<mod_date>2001/09/17</mod_date>
				<mod_writer>이지영</mod_writer>
				<mod_note></mod_note>
			</mod>
			<mod>
				<mod_date>2006/11/08</mod_date>
				<mod_writer>박진희</mod_writer>
				<mod_note></mod_note>
			</mod>
			<mod>
				<mod_date>2007/07/07></mod_date>
				<mod_writer>하신영</mod_writer>
				<mod_note></mod_note>
			</mod>
		</mnt_grp>
		<head_grp>
			<je_subtype>eft</je_subtype>
		</head_grp>
		<morph_grp>
			<phn_rst>vo</phn_rst>
			<mor_rst>nil</mor_rst>
			<str>nil</str>
			<var type="xs">ㄹ는지</var>
		</morph_grp>
		<sem_grp>
			<sense n="1">
				<sem_rep>
					<st></st>
					<sl></sl>
					<gm></gm>
				</sem_rep>
				<frn></frn>
				<fol></fol>
				<frame></frame>
				<sel_rst></sel_rst>
				<own_s>
					<nc></nc>
					<sp></sp>
				</own_s>
				<fol_s>
					<stt></stt>
					<prd></prd>
					<rep></rep>
					<sms></sms>
				</fol_s>
				<eg>내일은 비가 올런지?</eg>
			</sense>
		</sem_grp>
		<idm_grp>
			
				<idm></idm>
				<idm_eg></idm_eg>
			
		</idm_grp>
	</entry>
	<entry n="3" pos="e">
		<mnt_grp>

			<cre>
				<cre_date>2001/09/01</cre_date>
				<cre_writer>이승희</cre_writer>
				<cre_note></cre_note>
			</cre>
			<mod>
				<mod_date>2001/09/17</mod_date>
				<mod_writer>이지영</mod_writer>
				<mod_note></mod_note>
			</mod>
			<mod>
				<mod_date>2006/11/09</mod_date>
				<mod_writer>박진희</mod_writer>
				<mod_note></mod_note>
			</mod>
			<mod>
				<mod_date>2007/07/07></mod_date>
				<mod_writer>하신영</mod_writer>
				<mod_note></mod_note>
			</mod>
		</mnt_grp>
		<head_grp>
			<je_subtype>eft</je_subtype>
		</head_grp>
		<morph_grp>
			<phn_rst>vo</phn_rst>
			<mor_rst>nil</mor_rst>
			<str>nil</str>
			<var type="xs">ㄹ는지</var>
		</morph_grp>
		<sem_grp>
			<sense n="1">
				<sem_rep>
					<st></st>
					<sl></sl>
					<gm></gm>
				</sem_rep>
				<frn></frn>
				<fol></fol>
				<frame></frame>
				<sel_rst></sel_rst>
				<own_s>
					<nc></nc>
					<sp></sp>
				</own_s>
				<fol_s>
					<stt></stt>
					<prd></prd>
					<rep></rep>
					<sms></sms>
				</fol_s>
				<eg>어떤 사람이 새로 사장이 될런지 누가 알겠어?</eg>
			</sense>
		</sem_grp>
		<idm_grp>
			
				<idm></idm>
				<idm_eg></idm_eg>
			
		</idm_grp>
	</entry>
</superEntry>
