<?xml version="1.0" encoding="euc-kr" standalone="no"?>
<!DOCTYPE superEntry SYSTEM "2007eomi.dtd">
<superEntry>
	<orth>으라던지</orth>
	<entry n="1" pos="e">
		<mnt_grp>

			<cre>
				<cre_date>2001/08/27</cre_date>
				<cre_writer>이승희</cre_writer>
				<cre_note></cre_note>
			</cre>
			<mod>
				<mod_date>2001/09/17</mod_date>
				<mod_writer>이지영</mod_writer>
				<mod_note></mod_note>
			</mod>
			<mod>
				<mod_date>2003/08/10</mod_date>
				<mod_writer>김진형</mod_writer>
				<mod_note></mod_note>
			</mod>
			<mod>
				<mod_date>2006/11/17</mod_date>
				<mod_writer>하신영</mod_writer>
				<mod_note></mod_note>
			</mod>
			<mod>
				<mod_date>2007/07/08</mod_date>
				<mod_writer>하신영</mod_writer>
				<mod_note></mod_note>
			</mod>
		</mnt_grp>
		<head_grp>
			<je_subtype>ser</je_subtype>
		</head_grp>
		<morph_grp>
			<phn_rst>cn</phn_rst>
			<mor_rst>nil</mor_rst>
			<str></str>
			<var type="phn">라던지</var>
			<var type="xs">으라든지</var>
			<var type="etc">다던지</var>
			<var type="etc">ㄴ다던지</var>
			<var type="etc">는다던지</var>
			<var type="etc">자던지</var>
		</morph_grp>
		<sem_grp>
			<sense n="1">
				<sem_rep>
					<st></st>
					<sl></sl>
					<gm></gm>
				</sem_rep>
				<frn></frn>
				<fol></fol>
				<frame></frame>
				<sel_rst></sel_rst>
				<own_s>
					<nc></nc>
					<sp></sp>
				</own_s>
				<fol_s>
					<stt></stt>
					<prd></prd>
					<rep></rep>
					<sms></sms>
				</fol_s>
				<eg>그 수업 시간에는 학생들에게 책을 읽으라던지 자료를 찾으라던지 하는 요구를 하지 않는다.</eg>
			</sense>
		</sem_grp>
		<idm_grp>
			
				<idm></idm>
				<idm_eg></idm_eg>
			
		</idm_grp>
	</entry>
</superEntry>
