<?xml version="1.0" encoding="euc-kr" standalone="no"?>
<!DOCTYPE superEntry SYSTEM "2007eomi.dtd">
<superEntry>
	<orth>노라</orth>
	<entry n="1" pos="e">
		<mnt_grp>

			<cre>
				<cre_date>2001/07/22</cre_date>
				<cre_writer>이승희</cre_writer>
				<cre_note></cre_note>
			</cre>
			<mod>
				<mod_date>2001/09/14</mod_date>
				<mod_writer>이광호</mod_writer>
				<mod_note></mod_note>
			</mod>
			<mod>
				<mod_date>2006/11/02</mod_date>
				<mod_writer>박진희</mod_writer>
				<mod_note></mod_note>
			</mod>
			<mod>
				<mod_date>2007/07/07></mod_date>
				<mod_writer>하신영</mod_writer>
				<mod_note></mod_note>
			</mod>
		</mnt_grp>
		<head_grp>
			<je_subtype>eft</je_subtype>
		</head_grp>
		<morph_grp>
			<phn_rst>nil</phn_rst>
			<mor_rst>nil</mor_rst>
			<str>노+라</str>
		</morph_grp>
		<sem_grp>
			<sense n="1">
				<sem_rep>
					<st>평서</st>
					<sl>하라체</sl>
					<gm>단언</gm>
				</sem_rep>
				<frn>았</frn>
				<frn>았었</frn>
				<frn>겠</frn>
				<fol>nil</fol>
				<frame>Vv-E</frame>
				<frame>ass-E</frame>
				<frame>gss-E</frame>
				<sel_rst></sel_rst>
				<own_s>
					<nc></nc>
					<sp>1인칭</sp>
				</own_s>
				<fol_s>
					<stt></stt>
					<prd></prd>
					<rep></rep>
					<sms></sms>
				</fol_s>
				<eg>서러움 모두 버리고 나 이제 가노라.</eg>
				<eg>왔노라. 보았노라. 이겼노라.</eg>
				<!--예스러운 표현-->
			</sense>
		</sem_grp>
		<idm_grp>
			
				<idm></idm>
				<idm_eg></idm_eg>
			
		</idm_grp>
	</entry>
	<entry n="2" pos="e">
		<mnt_grp>

			<cre>
				<cre_date>2001/07/22</cre_date>
				<cre_writer>이승희</cre_writer>
				<cre_note></cre_note>
			</cre>
			<mod>
				<mod_date>2001/09/14</mod_date>
				<mod_writer>이광호</mod_writer>
				<mod_note></mod_note>
			</mod>
			<mod>
				<mod_date>2006/08/21</mod_date>
				<mod_writer>박진희</mod_writer>
				<mod_note></mod_note>
			</mod>
			<mod>
				<mod_date>2007/07/07></mod_date>
				<mod_writer>하신영</mod_writer>
				<mod_note></mod_note>
			</mod>
		</mnt_grp>
		<head_grp>
			<je_subtype>eft</je_subtype>
		</head_grp>
		<morph_grp>
			<phn_rst>nil</phn_rst>
			<mor_rst>nil</mor_rst>
			<str>노+라</str>
		</morph_grp>
		<sem_grp>
			<sense n="1">
				<sem_rep>
					<st></st>
					<sl>완형보문</sl>
					<gm>단언의간접인용</gm>
				</sem_rep>
				<frn>았</frn>
				<frn>겠</frn>
				<fol>고</fol>
				<frame>Vv-E</frame>
				<frame>ass-E</frame>
				<frame>gss-E</frame>
				<sel_rst></sel_rst>
				<own_s>
					<nc></nc>
					<sp>1인칭</sp>
				</own_s>
				<fol_s>
					<stt></stt>
					<prd></prd>
					<rep></rep>
					<sms></sms>
				</fol_s>
				<eg>병사들은 반드시 이기고 돌아오겠노라 맹세하였다.</eg>
				<!--예스러운 표현-->
			</sense>
		</sem_grp>
		<idm_grp>
			
				<idm></idm>
				<idm_eg></idm_eg>
			
		</idm_grp>
	</entry>
</superEntry>
