<?xml version="1.0" encoding="euc-kr" standalone="no"?>
<!DOCTYPE superEntry SYSTEM "2007eomi.dtd">
<superEntry>
	<orth>ㄴ다든</orth>
	<entry n="1" pos="e">
		<mnt_grp>

			<cre>
				<cre_date>2001/07/01</cre_date>
				<cre_writer>이승희</cre_writer>
				<cre_note></cre_note>
			</cre>
			<mod>
				<mod_date>2001/09/14</mod_date>
				<mod_writer>이광호</mod_writer>
				<mod_note></mod_note>
			</mod>
			<mod>
				<mod_date>2006/10/21</mod_date>
				<mod_writer>박진희</mod_writer>
				<mod_note>'ㄴ다던'의 비표준형임. 지침서에 따르면 표제어가 될 수 없음.</mod_note>
			</mod>
			<mod>
				<mod_date>2007/07/07></mod_date>
				<mod_writer>하신영</mod_writer>
				<mod_note></mod_note>
			</mod>
		</mnt_grp>
		<head_grp>
			<je_subtype>ser</je_subtype>
		</head_grp>
		<morph_grp>
			<phn_rst>vo</phn_rst>
			<mor_rst>nil</mor_rst>
			<str>ㄴ다-(고)_(하)-든</str>
			<var type="xs">ㄴ다던</var>
		</morph_grp>
		<sem_grp>
			<sense n="1">
				<sem_rep>
					<st></st>
					<sl></sl>
					<gm></gm>
				</sem_rep>
				<frn></frn>
				<fol></fol>
				<frame></frame>
				<sel_rst></sel_rst>
				<own_s>
					<nc></nc>
					<sp></sp>
				</own_s>
				<fol_s>
					<stt></stt>
					<prd></prd>
					<rep></rep>
					<sms></sms>
				</fol_s>
				<eg>아이들이 오늘 내려온다든?</eg>
				<eg>할머니께서는 언제쯤 오신다든?</eg>
			</sense>
		</sem_grp>
		<idm_grp>
			
				<idm></idm>
				<idm_eg></idm_eg>
			
		</idm_grp>
	</entry>
	<entry n="2" pos="e">
		<mnt_grp>

			<cre>
				<cre_date>2001/07/01</cre_date>
				<cre_writer>이승희</cre_writer>
				<cre_note></cre_note>
			</cre>
			<mod>
				<mod_date>2001/09/14</mod_date>
				<mod_writer>이광호</mod_writer>
				<mod_note></mod_note>
			</mod>
			<mod>
				<mod_date>2006/10/21</mod_date>
				<mod_writer>박진희</mod_writer>
				<mod_note>'ㄴ다던'의 비표준형임. 지침서에 따르면 표제어가 될 수 없음.</mod_note>
			</mod>
			<mod>
				<mod_date>2007/07/07></mod_date>
				<mod_writer>하신영</mod_writer>
				<mod_note></mod_note>
			</mod>
		</mnt_grp>
		<head_grp>
			<je_subtype>ser</je_subtype>
		</head_grp>
		<morph_grp>
			<phn_rst>vo</phn_rst>
			<mor_rst>nil</mor_rst>
			<str>ㄴ다+든</str>
			<var type="xs">ㄴ다던</var>
		</morph_grp>
		<sem_grp>
			<sense n="1">
				<sem_rep>
					<st></st>
					<sl></sl>
					<gm></gm>
				</sem_rep>
				<frn></frn>
				<fol></fol>
				<frame></frame>
				<sel_rst></sel_rst>
				<own_s>
					<nc></nc>
					<sp></sp>
				</own_s>
				<fol_s>
					<stt></stt>
					<prd></prd>
					<rep></rep>
					<sms></sms>
				</fol_s>
				<eg>도와준다든 사람들은 다 어디로 갔나?</eg>
			</sense>
		</sem_grp>
		<idm_grp>
			
				<idm></idm>
				<idm_eg></idm_eg>
			
		</idm_grp>
	</entry>
</superEntry>
